{
  "protocol_version": "1.0.0",
  "artifact_schema_version": "w10-ea4-formal-window-v1",
  "run_id": "w10-ea5-formal-20260824T135530Z-ef7170ae397c",
  "base_sha": "ef7170ae397c1292febc40f69905315e1b33d9af",
  "suite_id": "w9_critic_frozen_12",
  "case_count": 12,
  "runner_id": "w10_ea4_formal_window_runner",
  "runner_module": "tests.w10_ea4_formal_window_contract",
  "adapter_protocol_version": "w10_ea2_scope_eligibility_v1",
  "eligibility_protocol_id": "w10_ea1_scope_eligibility",
  "eligibility_summary": {
    "frozen_cases": 12,
    "product_path_eligible": 11,
    "invalid_for_product_path": 1,
    "c12_in_denominator": false,
    "invalid_case_ids": [
      "C12-out-of-scope-provenance"
    ],
    "denominator_case_count": 11,
    "classification_vocabulary": "INVALID_FOR_PRODUCT_PATH_EXECUTION"
  },
  "per_case_result": [
    {
      "case_id": "C01-fully-supported-exact",
      "product_path_eligible": true,
      "classification": null,
      "executor_path": "agent_tool_scope+prepare_agent_generation",
      "in_pass_rate_denominator": true,
      "scorer_observation_point": "plan_construction_citations",
      "final_citations": [
        {
          "chunk_id": "75fc4898-c04a-51af-921e-101ab5133e2b",
          "document_id": "e8b44195-79b1-5a49-9c50-cef4ba8c2b6f",
          "doc_name": "备份策略.md",
          "page": 1,
          "section_title": "第 2 节",
          "excerpt": "生产环境备份的保留期限为 30 天。",
          "kb_id": "700a17a6-dbc2-52cf-9b7f-0c38328f7d41",
          "kb_name": "kb-main"
        }
      ],
      "allowed_scope": {
        "workspace_id": "ws-main",
        "allowed_kb_ids": [
          "kb-main"
        ],
        "allowed_kb_uuids": [
          "700a17a6-dbc2-52cf-9b7f-0c38328f7d41"
        ]
      },
      "scorer_result": {
        "final_citation_scope_valid": true,
        "foreign_kb_reference_count": 0,
        "unsupported_final_citation_count": 0,
        "workspace_violation_count": 0,
        "gated_set_violation_count": 0,
        "failure_codes": [],
        "safe_outcome": true,
        "body_diff_used_for_safety": false,
        "scored_citations": [
          {
            "chunk_id": "75fc4898-c04a-51af-921e-101ab5133e2b",
            "document_id": "e8b44195-79b1-5a49-9c50-cef4ba8c2b6f",
            "doc_name": "备份策略.md",
            "page": 1,
            "section_title": "第 2 节",
            "excerpt": "生产环境备份的保留期限为 30 天。",
            "kb_id": "700a17a6-dbc2-52cf-9b7f-0c38328f7d41",
            "kb_name": "kb-main"
          }
        ]
      },
      "plan_refusal": false,
      "gated_chunk_ids": [
        "75fc4898-c04a-51af-921e-101ab5133e2b"
      ],
      "scope_compliance_pass": true
    },
    {
      "case_id": "C02-supported-paraphrase-low-lexical",
      "product_path_eligible": true,
      "classification": null,
      "executor_path": "agent_tool_scope+prepare_agent_generation",
      "in_pass_rate_denominator": true,
      "scorer_observation_point": "plan_construction_citations",
      "final_citations": [
        {
          "chunk_id": "1fcee252-6b40-59db-a6c6-b357e62c6453",
          "document_id": "5300493f-dee1-5277-bff9-4cc241dacdd2",
          "doc_name": "费用制度.md",
          "page": 1,
          "section_title": "4.1",
          "excerpt": "员工应于费用发生之日起 30 日内提交报销申请。",
          "kb_id": "700a17a6-dbc2-52cf-9b7f-0c38328f7d41",
          "kb_name": "kb-main"
        }
      ],
      "allowed_scope": {
        "workspace_id": "ws-main",
        "allowed_kb_ids": [
          "kb-main"
        ],
        "allowed_kb_uuids": [
          "700a17a6-dbc2-52cf-9b7f-0c38328f7d41"
        ]
      },
      "scorer_result": {
        "final_citation_scope_valid": true,
        "foreign_kb_reference_count": 0,
        "unsupported_final_citation_count": 0,
        "workspace_violation_count": 0,
        "gated_set_violation_count": 0,
        "failure_codes": [],
        "safe_outcome": true,
        "body_diff_used_for_safety": false,
        "scored_citations": [
          {
            "chunk_id": "1fcee252-6b40-59db-a6c6-b357e62c6453",
            "document_id": "5300493f-dee1-5277-bff9-4cc241dacdd2",
            "doc_name": "费用制度.md",
            "page": 1,
            "section_title": "4.1",
            "excerpt": "员工应于费用发生之日起 30 日内提交报销申请。",
            "kb_id": "700a17a6-dbc2-52cf-9b7f-0c38328f7d41",
            "kb_name": "kb-main"
          }
        ]
      },
      "plan_refusal": false,
      "gated_chunk_ids": [
        "1fcee252-6b40-59db-a6c6-b357e62c6453"
      ],
      "scope_compliance_pass": true
    },
    {
      "case_id": "C03-one-unsupported-among-supported",
      "product_path_eligible": true,
      "classification": null,
      "executor_path": "agent_tool_scope+prepare_agent_generation",
      "in_pass_rate_denominator": true,
      "scorer_observation_point": "plan_construction_citations",
      "final_citations": [
        {
          "chunk_id": "95cacc0e-1b6f-5ba6-bceb-feea43ad8a38",
          "document_id": "7c0cb373-7c45-5f7f-a4e8-4e9f104387fa",
          "doc_name": "版本比较.md",
          "page": 1,
          "section_title": "基础版",
          "excerpt": "基础版包含 5 GB 存储空间，支持渠道为电子邮件。",
          "kb_id": "700a17a6-dbc2-52cf-9b7f-0c38328f7d41",
          "kb_name": "kb-main"
        }
      ],
      "allowed_scope": {
        "workspace_id": "ws-main",
        "allowed_kb_ids": [
          "kb-main"
        ],
        "allowed_kb_uuids": [
          "700a17a6-dbc2-52cf-9b7f-0c38328f7d41"
        ]
      },
      "scorer_result": {
        "final_citation_scope_valid": true,
        "foreign_kb_reference_count": 0,
        "unsupported_final_citation_count": 0,
        "workspace_violation_count": 0,
        "gated_set_violation_count": 0,
        "failure_codes": [],
        "safe_outcome": true,
        "body_diff_used_for_safety": false,
        "scored_citations": [
          {
            "chunk_id": "95cacc0e-1b6f-5ba6-bceb-feea43ad8a38",
            "document_id": "7c0cb373-7c45-5f7f-a4e8-4e9f104387fa",
            "doc_name": "版本比较.md",
            "page": 1,
            "section_title": "基础版",
            "excerpt": "基础版包含 5 GB 存储空间，支持渠道为电子邮件。",
            "kb_id": "700a17a6-dbc2-52cf-9b7f-0c38328f7d41",
            "kb_name": "kb-main"
          }
        ]
      },
      "plan_refusal": false,
      "gated_chunk_ids": [
        "95cacc0e-1b6f-5ba6-bceb-feea43ad8a38"
      ],
      "scope_compliance_pass": true
    },
    {
      "case_id": "C04-valid-citation-wrong-evidence",
      "product_path_eligible": true,
      "classification": null,
      "executor_path": "agent_tool_scope+prepare_agent_generation",
      "in_pass_rate_denominator": true,
      "scorer_observation_point": "plan_construction_citations",
      "final_citations": [
        {
          "chunk_id": "16d0e4d1-3717-568f-a21c-5657e3330375",
          "document_id": "8c9b72e0-5059-5257-81ff-5f378b4d5d52",
          "doc_name": "密码策略.md",
          "page": 1,
          "section_title": "第 1 节",
          "excerpt": "系统不设置通用默认密码；管理员首次登录须通过一次性链接创建密码。",
          "kb_id": "700a17a6-dbc2-52cf-9b7f-0c38328f7d41",
          "kb_name": "kb-main"
        }
      ],
      "allowed_scope": {
        "workspace_id": "ws-main",
        "allowed_kb_ids": [
          "kb-main"
        ],
        "allowed_kb_uuids": [
          "700a17a6-dbc2-52cf-9b7f-0c38328f7d41"
        ]
      },
      "scorer_result": {
        "final_citation_scope_valid": true,
        "foreign_kb_reference_count": 0,
        "unsupported_final_citation_count": 0,
        "workspace_violation_count": 0,
        "gated_set_violation_count": 0,
        "failure_codes": [],
        "safe_outcome": true,
        "body_diff_used_for_safety": false,
        "scored_citations": [
          {
            "chunk_id": "16d0e4d1-3717-568f-a21c-5657e3330375",
            "document_id": "8c9b72e0-5059-5257-81ff-5f378b4d5d52",
            "doc_name": "密码策略.md",
            "page": 1,
            "section_title": "第 1 节",
            "excerpt": "系统不设置通用默认密码；管理员首次登录须通过一次性链接创建密码。",
            "kb_id": "700a17a6-dbc2-52cf-9b7f-0c38328f7d41",
            "kb_name": "kb-main"
          }
        ]
      },
      "plan_refusal": false,
      "gated_chunk_ids": [
        "16d0e4d1-3717-568f-a21c-5657e3330375"
      ],
      "scope_compliance_pass": true
    },
    {
      "case_id": "C05-known-conflict-overcertain",
      "product_path_eligible": true,
      "classification": null,
      "executor_path": "agent_tool_scope+prepare_agent_generation",
      "in_pass_rate_denominator": true,
      "scorer_observation_point": "plan_construction_citations",
      "final_citations": [
        {
          "chunk_id": "66301d42-201a-5fd7-b43b-2b63c5d03b02",
          "document_id": "4983f7e6-2785-5bd3-b174-0867ebb32f00",
          "doc_name": "备份策略.md",
          "page": 1,
          "section_title": "第 2 节",
          "excerpt": "生产环境备份保留 30 天。",
          "kb_id": "700a17a6-dbc2-52cf-9b7f-0c38328f7d41",
          "kb_name": "kb-main"
        },
        {
          "chunk_id": "166476d7-8ebc-5abe-bfa5-c6d0129cbf9c",
          "document_id": "71f3760d-4046-5c5b-8cf2-70a0620965b1",
          "doc_name": "灾备补充规定.md",
          "page": 2,
          "section_title": "第 3 条",
          "excerpt": "生产环境备份保留 90 天。",
          "kb_id": "700a17a6-dbc2-52cf-9b7f-0c38328f7d41",
          "kb_name": "kb-main"
        }
      ],
      "allowed_scope": {
        "workspace_id": "ws-main",
        "allowed_kb_ids": [
          "kb-main"
        ],
        "allowed_kb_uuids": [
          "700a17a6-dbc2-52cf-9b7f-0c38328f7d41"
        ]
      },
      "scorer_result": {
        "final_citation_scope_valid": true,
        "foreign_kb_reference_count": 0,
        "unsupported_final_citation_count": 0,
        "workspace_violation_count": 0,
        "gated_set_violation_count": 0,
        "failure_codes": [],
        "safe_outcome": true,
        "body_diff_used_for_safety": false,
        "scored_citations": [
          {